{
  "$schema" : "https://vibedeck-schema.alanreisanjo.workers.dev/v1/review-group.schema.json",
  "createdAt" : "2026-10-07T17:24:51Z",
  "id" : "91E1DE50-910E-4B35-91BF-F2CC87E8F63C",
  "items" : [
    {
      "author" : "human",
      "createdAt" : "2026-10-07T17:27:29Z",
      "id" : "06D6A4F9-73E0-4E23-9522-4AFF40BD3222",
      "kind" : "fix",
      "priority" : "normal",
      "status" : "open",
      "title" : "yterste",
      "updatedAt" : "2026-10-07T17:27:29Z"
    }
  ],
  "title" : "Funcionamento da tela"
}
