{
  "$schema" : "https://vibedeck-schema.alanreisanjo.workers.dev/v1/review-group.schema.json",
  "createdAt" : "2026-10-09T03:19:00Z",
  "id" : "73D22196-01D9-4BCC-A4E3-7A6F6E597574",
  "items" : [
    {
      "author" : "human",
      "createdAt" : "2026-10-09T03:20:42Z",
      "details" : "Ocultar na lista do painel da esquerda, os tópicos de revisões sem itens pendentes. Podem ser visíveis pela tabela da tela central de revisões. Mas no painel lateral, não",
      "id" : "28CA584A-EE28-42C2-ACAA-95750B20D030",
      "kind" : "hide",
      "priority" : "normal",
      "rules" : [
        "interface-do-app",
        "dinamicas-da-interface"
      ],
      "status" : "done",
      "target" : {
        "component" : "ProjectWindow (sidebar, case .groups)",
        "file" : "Sources/VibeDeckApp/ProjectWindow.swift"
      },
      "title" : "Reduzir exibição dos itens do Painel Lateral",
      "updatedAt" : "2026-10-09T18:44:39Z"
    },
    {
      "author" : "human",
      "createdAt" : "2026-10-09T03:21:22Z",
      "details" : "Aparentemente, isso era pq eu estava trocando de tela sem  salvar os detalhes, mas eu vou confirmar isso ainda",
      "id" : "9EF0D030-3B21-4A96-8A13-6A2163A54A4F",
      "kind" : "note",
      "priority" : "low",
      "rules" : [
        "interface-do-app",
        "dinamicas-da-interface",
        "core-e-formato-de-dados",
        "conceitos-do-produto"
      ],
      "status" : "done",
      "target" : {
        "component" : "CommitTextField",
        "file" : "Sources/VibeDeckApp/ReviewGroupView.swift"
      },
      "title" : "Os detalhes dos itens das revisões não está salvando os itens. Ou se está salvando, não está carregando",
      "updatedAt" : "2026-10-22T13:12:57Z"
    },
    {
      "author" : "human",
      "createdAt" : "2026-10-09T15:55:33Z",
      "details" : "Gostaria que todos os itens dos tópicos das revisões mostrassem o grau de prioridade, pois fica mais fácil de selecionar depois\n\nAtualmente, só os itens com prioridade alta mostra",
      "id" : "8A856584-36DF-4F56-878C-66A5CBA5792E",
      "kind" : "fix",
      "priority" : "high",
      "status" : "done",
      "title" : "Exibir grau de prioridade dos itens",
      "updatedAt" : "2026-10-22T13:19:27Z"
    }
  ],
  "title" : "Revisões"
}
